{
  "id": "shadcn-select",
  "title": "Select",
  "source_url": "https://ui.shadcn.com/docs/components/select",
  "kind": "component",
  "source": "shadcn",
  "vibe": [
    "minimal"
  ],
  "scene": [
    "auth",
    "app-shell"
  ],
  "stack": [
    "react",
    "tailwind",
    "typescript",
    "radix"
  ],
  "license": "free",
  "preview": {
    "embed_url": "https://ui.shadcn.com/docs/components/select",
    "screenshot": "/previews/shadcn/shadcn-select.png"
  },
  "usage": "Harvested from official shadcn registry (new-york).\n\n```bash\nnpx shadcn@latest add select\n```",
  "notes": "Auto-harvested from https://ui.shadcn.com/r/styles/new-york/registry.json (type registry:ui). vibe/scene provisional for review. Docs URL assumed from name. Screenshot backfilled from docs page preview region. Primary preview: live source via preview.embed_url (shadcn/ui docs page). No dedicated component embed URL discovered; docs pages often block iframes. screenshot is optional offline fallback; UI must join BASE_URL.",
  "status": "pending_review",
  "created_at": "2026-10-14T10:00:27.095Z",
  "updated_at": "2026-10-14T12:28:09.091Z"
}
