{
  "id": "shadcn-input",
  "title": "Input",
  "source_url": "https://ui.shadcn.com/docs/components/input",
  "kind": "component",
  "source": "shadcn",
  "vibe": [
    "minimal"
  ],
  "scene": [
    "auth",
    "app-shell"
  ],
  "stack": [
    "react",
    "tailwind",
    "typescript",
    "radix"
  ],
  "license": "free",
  "preview": {
    "embed_url": "https://ui.shadcn.com/docs/components/input"
  },
  "usage": "Harvested from official shadcn registry (new-york).\n\n```bash\nnpx shadcn@latest add input\n```",
  "notes": "Auto-harvested from https://ui.shadcn.com/r/styles/new-york/registry.json (type registry:ui). vibe/scene provisional for review. Docs URL assumed from name.",
  "status": "pending_review",
  "created_at": "2026-10-14T10:00:27.095Z",
  "updated_at": "2026-10-14T10:00:27.095Z"
}
