{
  "id": "uiverse-progee45-nice-bobcat-8",
  "title": "Nice Bobcat 8",
  "source_url": "https://uiverse.io/Progee45/nice-bobcat-8",
  "kind": "component",
  "source": "uiverse",
  "vibe": [
    "趣味交互"
  ],
  "scene": [
    "landing",
    "marketing"
  ],
  "stack": [
    "html",
    "css"
  ],
  "license": "free",
  "preview": {
    "screenshot": "/previews/uiverse/uiverse-progee45-nice-bobcat-8.png",
    "embed_url": "https://uiverse.io/Progee45/nice-bobcat-8"
  },
  "usage": "Harvested from Uiverse galaxy (`Buttons/Progee45_nice-bobcat-8.html`).\n\nOpen https://uiverse.io/Progee45/nice-bobcat-8 and copy HTML/CSS (MIT via uiverse-io/galaxy).",
  "notes": "Auto-harvested from https://github.com/uiverse-io/galaxy. Author `Progee45`. tags: button, animated. vibe/scene provisional for review. Screenshot rendered locally from galaxy HTML+CSS.",
  "status": "pending_review",
  "created_at": "2026-10-14T10:34:54.985Z",
  "updated_at": "2026-10-14T10:45:16.758Z"
}
