{
  "id": "uiverse-0xnihilism-calm-baboon-55",
  "title": "Calm Baboon 55",
  "source_url": "https://uiverse.io/0xnihilism/calm-baboon-55",
  "kind": "component",
  "source": "uiverse",
  "vibe": [
    "趣味交互"
  ],
  "scene": [
    "app-shell",
    "docs"
  ],
  "stack": [
    "html",
    "css"
  ],
  "license": "free",
  "preview": {
    "screenshot": "/previews/uiverse/uiverse-0xnihilism-calm-baboon-55.png",
    "embed_url": "https://uiverse.io/0xnihilism/calm-baboon-55"
  },
  "usage": "Harvested from Uiverse galaxy (`Inputs/0xnihilism_calm-baboon-55.html`).\n\nOpen https://uiverse.io/0xnihilism/calm-baboon-55 and copy HTML/CSS (MIT via uiverse-io/galaxy).",
  "notes": "Auto-harvested from https://github.com/uiverse-io/galaxy. Author `0xnihilism`. tags: simple, input, smooth, flip, hover button, brutalist. vibe/scene provisional for review. Screenshot rendered locally from galaxy HTML+CSS. Primary preview: live source via preview.embed_url (Uiverse element page). No dedicated official embed endpoint found in page HTML; iframe may be blocked by CSP/X-Frame-Options. screenshot is optional offline fallback; UI must join BASE_URL.",
  "status": "pending_review",
  "created_at": "2026-10-14T10:34:54.985Z",
  "updated_at": "2026-10-14T12:28:09.091Z"
}
