{
  "id": "uiverse-e-coders-new-shrimp-32",
  "title": "New Shrimp 32",
  "source_url": "https://uiverse.io/e-coders/new-shrimp-32",
  "kind": "component",
  "source": "uiverse",
  "vibe": [
    "趣味交互"
  ],
  "scene": [
    "landing",
    "marketing"
  ],
  "stack": [
    "html",
    "css"
  ],
  "license": "free",
  "preview": {
    "screenshot": "/previews/uiverse/uiverse-e-coders-new-shrimp-32.png",
    "embed_url": "https://uiverse.io/e-coders/new-shrimp-32"
  },
  "usage": "Harvested from Uiverse galaxy (`Buttons/e-coders_new-shrimp-32.html`).\n\nOpen https://uiverse.io/e-coders/new-shrimp-32 and copy HTML/CSS (MIT via uiverse-io/galaxy).",
  "notes": "Auto-harvested from https://github.com/uiverse-io/galaxy. Author `e-coders`. tags: simple, minimalist, button. vibe/scene provisional for review. Screenshot rendered locally from galaxy HTML+CSS. Primary preview: live source via preview.embed_url (Uiverse element page). No dedicated official embed endpoint found in page HTML; iframe may be blocked by CSP/X-Frame-Options. screenshot is optional offline fallback; UI must join BASE_URL.",
  "status": "pending_review",
  "created_at": "2026-10-14T10:34:54.985Z",
  "updated_at": "2026-10-14T12:28:09.091Z"
}
