{
  "id": "uiverse-andrew-demchenk0-green-deer-16",
  "title": "Green Deer 16",
  "source_url": "https://uiverse.io/andrew-demchenk0/green-deer-16",
  "kind": "component",
  "source": "uiverse",
  "vibe": [
    "趣味交互"
  ],
  "scene": [
    "app-shell",
    "docs"
  ],
  "stack": [
    "html",
    "css"
  ],
  "license": "free",
  "preview": {
    "screenshot": "/previews/uiverse/uiverse-andrew-demchenk0-green-deer-16.png",
    "embed_url": "https://uiverse.io/andrew-demchenk0/green-deer-16"
  },
  "usage": "Harvested from Uiverse galaxy (`Inputs/andrew-demchenk0_green-deer-16.html`).\n\nOpen https://uiverse.io/andrew-demchenk0/green-deer-16 and copy HTML/CSS (MIT via uiverse-io/galaxy).",
  "notes": "Auto-harvested from https://github.com/uiverse-io/galaxy. Author `andrew-demchenk0`. tags: input. vibe/scene provisional for review. Screenshot rendered locally from galaxy HTML+CSS.",
  "status": "pending_review",
  "created_at": "2026-10-14T10:34:54.985Z",
  "updated_at": "2026-10-14T10:45:16.758Z"
}
