{
  "id": "magicui-sparkles-text",
  "title": "Sparkles Text",
  "source_url": "https://magicui.design/docs/components/sparkles-text",
  "kind": "component",
  "source": "magicui",
  "vibe": [
    "playful",
    "cinematic"
  ],
  "scene": [
    "landing",
    "marketing"
  ],
  "stack": [
    "react",
    "tailwind",
    "typescript",
    "motion"
  ],
  "license": "free",
  "preview": {
    "embed_url": "https://magicui.design/docs/components/sparkles-text"
  },
  "usage": "Harvested from Magic UI registry.\n\n```bash\nnpx shadcn@latest add @magicui/sparkles-text\n```\n\nA dynamic text that generates continuous sparkles with smooth transitions, perfect for highlighting text with animated stars.",
  "notes": "Auto-harvested from https://magicui.design/r/registry.json (type registry:ui). vibe/scene provisional for review.",
  "status": "pending_review",
  "created_at": "2026-10-14T10:00:27.095Z",
  "updated_at": "2026-10-14T10:00:27.095Z"
}
