{
  "id": "uiverse-yuge0-dangerous-parrot-21",
  "title": "Dangerous Parrot 21",
  "source_url": "https://uiverse.io/YUGE0/dangerous-parrot-21",
  "kind": "component",
  "source": "uiverse",
  "vibe": [
    "趣味交互"
  ],
  "scene": [
    "landing",
    "marketing"
  ],
  "stack": [
    "html",
    "css"
  ],
  "license": "free",
  "preview": {
    "screenshot": "/previews/uiverse/uiverse-yuge0-dangerous-parrot-21.png",
    "embed_url": "https://uiverse.io/YUGE0/dangerous-parrot-21"
  },
  "usage": "Harvested from Uiverse galaxy (`Buttons/YUGE0_dangerous-parrot-21.html`).\n\nOpen https://uiverse.io/YUGE0/dangerous-parrot-21 and copy HTML/CSS (MIT via uiverse-io/galaxy).",
  "notes": "Auto-harvested from https://github.com/uiverse-io/galaxy. Author `YUGE0`. vibe/scene provisional for review. Screenshot rendered locally from galaxy HTML+CSS.",
  "status": "pending_review",
  "created_at": "2026-10-14T10:34:54.985Z",
  "updated_at": "2026-10-14T10:45:16.758Z"
}
