{
  "id": "magicui-marquee",
  "title": "Marquee",
  "source_url": "https://magicui.design/docs/components/marquee",
  "kind": "component",
  "source": "magicui",
  "vibe": [
    "playful",
    "cinematic"
  ],
  "scene": [
    "landing",
    "marketing"
  ],
  "stack": [
    "react",
    "tailwind",
    "typescript",
    "motion"
  ],
  "license": "free",
  "preview": {
    "embed_url": "https://magicui.design/docs/components/marquee",
    "screenshot": "/previews/magicui/magicui-marquee.png"
  },
  "usage": "Harvested from Magic UI registry.\n\n```bash\nnpx shadcn@latest add @magicui/marquee\n```\n\nAn infinite scrolling component that can be used to display text, images, or videos.",
  "notes": "Auto-harvested from https://magicui.design/r/registry.json (type registry:ui). vibe/scene provisional for review. Screenshot backfilled from docs page preview region. Primary preview: live source via preview.embed_url (Magic UI docs page). No dedicated component embed URL discovered; docs pages often block iframes. screenshot is optional offline fallback; UI must join BASE_URL.",
  "status": "pending_review",
  "created_at": "2026-10-14T10:00:27.095Z",
  "updated_at": "2026-10-14T12:28:09.091Z"
}
