{
  "id": "21st-azacdev-form",
  "title": "Form",
  "source_url": "https://21st.dev/@azacdev/components/form",
  "kind": "component",
  "source": "21st",
  "vibe": [
    "产品级组件橱窗"
  ],
  "scene": [
    "app-shell",
    "docs"
  ],
  "stack": [
    "react",
    "tailwind",
    "typescript"
  ],
  "license": "mixed",
  "preview": {
    "screenshot": "/previews/21st/21st-azacdev-form.png",
    "embed_url": "https://21st.dev/@azacdev/components/form"
  },
  "usage": "Browse live preview: https://21st.dev/@azacdev/components/form\n\nInstall via 21st registry (requires API key):\n\n```bash\nnpx shadcn@latest add \"https://21st.dev/r/azacdev/form?api_key=$API_KEY_21ST\"\n```",
  "notes": "Auto-harvested from 21st community category `input` (Inputs). Author `@azacdev`. vibe/scene provisional for review. Screenshot from 21st OG image. Skipped Magic UI (@dillionverma) duplicates.",
  "status": "pending_review",
  "created_at": "2026-10-14T10:34:54.985Z",
  "updated_at": "2026-10-14T10:45:16.758Z"
}
