{
  "id": "21st-felipemenezes098-hero-04",
  "title": "Editorial Collage Hero",
  "source_url": "https://21st.dev/@felipemenezes098/components/hero-04",
  "kind": "component",
  "source": "21st",
  "vibe": [
    "产品级组件橱窗"
  ],
  "scene": [
    "landing",
    "marketing"
  ],
  "stack": [
    "react",
    "tailwind",
    "typescript"
  ],
  "license": "mixed",
  "preview": {
    "screenshot": "/previews/21st/21st-felipemenezes098-hero-04.png",
    "embed_url": "https://cdn.21st.dev/felipemenezes098/hero-04/default/bundle.1783678911730.html?theme=light"
  },
  "usage": "Browse live preview: https://21st.dev/@felipemenezes098/components/hero-04\n\nInstall via 21st registry (requires API key):\n\n```bash\nnpx shadcn@latest add \"https://21st.dev/r/felipemenezes098/hero-04?api_key=$API_KEY_21ST\"\n```",
  "notes": "Auto-harvested from 21st community category `hero` (Hero). Author `@felipemenezes098`. license reported: no-license; deps: motion, react-wrap-balancer. vibe/scene provisional for review. Screenshot from Playwright capture of live component preview iframe (cdn.21st.dev), not OG. Skipped Magic UI (@dillionverma) duplicates. Primary preview: live source via preview.embed_url (cdn.21st.dev …/bundle.<ts>.html?theme=light iframe). screenshot is optional offline fallback only; on GitHub Pages the UI must resolve screenshot with import.meta.env.BASE_URL (absolute /previews/… 404s).",
  "status": "pending_review",
  "created_at": "2026-10-14T10:34:54.985Z",
  "updated_at": "2026-10-14T12:28:09.091Z"
}
