{
  "id": "uiverse-nlghtm4re-evil-warthog-61",
  "title": "Evil Warthog 61",
  "source_url": "https://uiverse.io/NlghtM4re/evil-warthog-61",
  "kind": "component",
  "source": "uiverse",
  "vibe": [
    "趣味交互"
  ],
  "scene": [
    "marketing",
    "landing"
  ],
  "stack": [
    "html",
    "css"
  ],
  "license": "free",
  "preview": {
    "screenshot": "/previews/uiverse/uiverse-nlghtm4re-evil-warthog-61.png",
    "embed_url": "https://uiverse.io/NlghtM4re/evil-warthog-61"
  },
  "usage": "Harvested from Uiverse galaxy (`Cards/NlghtM4re_evil-warthog-61.html`).\n\nOpen https://uiverse.io/NlghtM4re/evil-warthog-61 and copy HTML/CSS (MIT via uiverse-io/galaxy).",
  "notes": "Auto-harvested from https://github.com/uiverse-io/galaxy. Author `NlghtM4re`. tags: green, card, code, menu. vibe/scene provisional for review. Screenshot rendered locally from galaxy HTML+CSS. Primary preview: live source via preview.embed_url (Uiverse element page). No dedicated official embed endpoint found in page HTML; iframe may be blocked by CSP/X-Frame-Options. screenshot is optional offline fallback; UI must join BASE_URL.",
  "status": "pending_review",
  "created_at": "2026-10-14T10:34:54.985Z",
  "updated_at": "2026-10-14T12:28:09.091Z"
}
