{
  "id": "magicui-smooth-cursor",
  "title": "Smooth Cursor",
  "source_url": "https://magicui.design/docs/components/smooth-cursor",
  "kind": "component",
  "source": "magicui",
  "vibe": [
    "playful"
  ],
  "scene": [
    "landing",
    "marketing"
  ],
  "stack": [
    "react",
    "tailwind",
    "typescript",
    "motion"
  ],
  "license": "free",
  "preview": {
    "embed_url": "https://magicui.design/docs/components/smooth-cursor"
  },
  "usage": "Harvested from Magic UI registry.\n\n```bash\nnpx shadcn@latest add @magicui/smooth-cursor\n```\n\nA customizable, physics-based smooth cursor animation component with spring animations and rotation effects",
  "notes": "Auto-harvested from https://magicui.design/r/registry.json (type registry:ui). vibe/scene provisional for review.",
  "status": "pending_review",
  "created_at": "2026-10-14T10:00:27.095Z",
  "updated_at": "2026-10-14T10:00:27.095Z"
}
