{
  "id": "21st-mokshithgujjeti-dev-tool-landing-page",
  "title": "DevTool Landing Page",
  "source_url": "https://21st.dev/@mokshithgujjeti/components/dev-tool-landing-page",
  "kind": "component",
  "source": "21st",
  "vibe": [
    "产品级组件橱窗"
  ],
  "scene": [
    "landing",
    "marketing"
  ],
  "stack": [
    "react",
    "tailwind",
    "typescript"
  ],
  "license": "mixed",
  "preview": {
    "screenshot": "/previews/21st/21st-mokshithgujjeti-dev-tool-landing-page.png",
    "embed_url": "https://cdn.21st.dev/mokshithcodez/dev-tool-landing-page/default/bundle.1784374196005-54529962-8ec9-4b0d-97ca-b24ac8774a6b.html?theme=light"
  },
  "usage": "Browse live preview: https://21st.dev/@mokshithgujjeti/components/dev-tool-landing-page\n\nInstall via 21st registry (requires API key):\n\n```bash\nnpx shadcn@latest add \"https://21st.dev/r/mokshithgujjeti/dev-tool-landing-page?api_key=$API_KEY_21ST\"\n```",
  "notes": "Auto-harvested from 21st community category `hero` (Hero). Author `@mokshithgujjeti`. license reported: mit; deps: lucide-react, framer-motion. vibe/scene provisional for review. Screenshot from Playwright capture of live component preview iframe (cdn.21st.dev), not OG. Skipped Magic UI (@dillionverma) duplicates. Primary preview: live source via preview.embed_url (cdn.21st.dev …/bundle.<ts>.html?theme=light iframe). screenshot is optional offline fallback only; on GitHub Pages the UI must resolve screenshot with import.meta.env.BASE_URL (absolute /previews/… 404s).",
  "status": "pending_review",
  "created_at": "2026-10-14T10:34:54.985Z",
  "updated_at": "2026-10-14T12:28:09.091Z"
}
