{
  "id": "21st-ibelick-promt-input-with-actions",
  "title": "Promt Input with Actions",
  "source_url": "https://21st.dev/@ibelick/components/promt-input-with-actions",
  "kind": "component",
  "source": "21st",
  "vibe": [
    "产品级组件橱窗"
  ],
  "scene": [
    "app-shell",
    "docs"
  ],
  "stack": [
    "react",
    "tailwind",
    "typescript"
  ],
  "license": "mixed",
  "preview": {
    "screenshot": "/previews/21st/21st-ibelick-promt-input-with-actions.png",
    "embed_url": "https://21st.dev/@ibelick/components/promt-input-with-actions"
  },
  "usage": "Browse live preview: https://21st.dev/@ibelick/components/promt-input-with-actions\n\nInstall via 21st registry (requires API key):\n\n```bash\nnpx shadcn@latest add \"https://21st.dev/r/ibelick/promt-input-with-actions?api_key=$API_KEY_21ST\"\n```",
  "notes": "Auto-harvested from 21st community category `input` (Inputs). Author `@ibelick`. library: Prompt Kit; license reported: unknown; deps: lucide-react. vibe/scene provisional for review. Screenshot from Playwright capture of live component preview iframe (cdn.21st.dev), not OG. Skipped Magic UI (@dillionverma) duplicates.",
  "status": "pending_review",
  "created_at": "2026-10-14T10:34:54.985Z",
  "updated_at": "2026-10-14T11:02:14.745Z"
}
